{
  "$schema": "https://json-schema.org/draft/2020-12/schema",
  "$id": "https://ai2live.dev/schemas/character.schema.json",
  "title": "CharacterSpec",
  "description": "Character identity and art-direction specification for AI Live2D Asset Compiler",
  "type": "object",
  "additionalProperties": false,
  "required": ["id", "name", "version"],
  "properties": {
    "id": {
      "type": "string",
      "minLength": 1,
      "description": "Stable UUID or ULID for this character"
    },
    "name": { "type": "string", "minLength": 1 },
    "version": { "type": "string", "const": "0.1" },
    "description": { "type": "string" },
    "art_style": { "type": "string" },
    "canvas": {
      "type": "object",
      "additionalProperties": false,
      "required": ["width", "height"],
      "properties": {
        "width": { "type": "integer", "minimum": 1 },
        "height": { "type": "integer", "minimum": 1 }
      }
    },
    "identity_prompt": { "type": "string" },
    "tags": {
      "type": "array",
      "items": { "type": "string" }
    },
    "notes": { "type": "string" }
  }
}
